2021-04-30 05:46:56,b'@deepigoyal @zomato Just a suggestion ....lot of covid warriors helping people out by delivering food to patients..\xe2\x80\xa6 https://t.co/4nglGZovRz',b'i_sid007',b'India'
2021-04-30 05:46:54,b'@SaranshGoila I am providing covid relief meal in West Bengal through your platform. Can you advise any way to arra\xe2\x80\xa6 https://t.co/B2gBaEttkg',b'gourav_bhatta4g',b'Hong Kong'
2021-04-30 05:44:57,b'@zomato @deepigoyal \nI had a scary and bad experience with Zomato today with my order # 2148327632.\nI trust ZOMATO\xe2\x80\xa6 https://t.co/1PX9R2RiQR',b'AfrozKh08653300',"b'Pune, India'"
2021-04-30 05:11:07,b'Really impressed by the steps taken by @zomato to help during these times. Introducing special delivery for covid p\xe2\x80\xa6 https://t.co/KF3hhaFRdy',b'aadigawde',"b'MUMBAI,  INDIA'"
2021-04-30 05:08:52,"b'*Personally Verified at 10:34 AM, April 30* \n\nOxygen Cylinders (free of cost) \n\nLocation: Indore \n\nRequirements: Co\xe2\x80\xa6 https://t.co/M34f0numxg'",b'shiiivii15',b'Delhi/NCR '
2021-04-30 04:47:41,b'Homemade food for free for covid patients in Manjari and Hadapsar areas in Pune. (Home Delivery) Please connect if\xe2\x80\xa6 https://t.co/6xgpTIcc1X',b'jagrititanu',b'Pune'
2021-04-30 04:03:47,"b'Ration Kit &amp; Covid Mask delivery by Be Donor to support the country amid the second wave of Pandemic, Do your bit b\xe2\x80\xa6 https://t.co/OfxRsyVN7S'",b'bedonorindia',b''
2021-04-30 03:37:31,b'Perhaps food delivery companies can engage in collection of COVID test samples @swiggy_in @zomatoin',b'imrt01',b''
2021-04-30 03:19:20,"b'You are more likely to contract Covid while going to the grocery than you are to get it from food delivery. Please,\xe2\x80\xa6 https://t.co/fe5izEiu9M'",b'keshan_w',b''
2021-04-30 01:31:00,"b'#Delhi gurdwara starts \xe2\x80\x98#OxygenLangar\xe2\x80\x99, food delivery for #COVID19 patients https://t.co/bNoCaWPB7g'",b'thetribunechd',b'Chandigarh'
2021-04-30 01:19:05,"b'What happened to food delivery in Pittsburgh? Seems like every time we try to order something, there are never any\xe2\x80\xa6 https://t.co/47zoNQ0DAr'",b'Antnommer',"b'Pittsburgh, PA'"
2021-04-30 01:06:56,b'Global Virtual Restaurant Food Delivery Market Covid-19 Impact Growing Technology Trends and ...\nhttps://t.co/jSy7ULK48q',b'RideshareAZ',"b'Phoenix, AZ'"
2021-04-30 00:24:26,"b'As the world open up this is the inevitable fate for 3rd Party Platforms, Ghost Kitchens and Delivery Services... https://t.co/wngUH2PEDT'",b'BizAdvisor',b'Everywhere'
2021-04-29 22:14:51,"b'First Wayfair, then Blue Apron, and now Theta\xe2\x80\x99s co-founder @d_mccar dishes on your favorite #FoodDelivery services.\xe2\x80\xa6 https://t.co/cVp443Rlz6'",b'ThetaEquity',b''
2021-04-29 22:02:25,b'NEW YORK: The crowded food delivery app industry that skyrocketed during COVID face a multi-billion dollar hit amid\xe2\x80\xa6 https://t.co/aekw6dxZCs',b'KolHaolam',b''
2021-04-29 21:31:43,"b'Here goes another food home delivery option for COVID families living around Garia , Baghajatin , 8B , Ranikuthi. https://t.co/uNyVJGKZpk'",b'QEBNA',"b'Kolkata, India'"
2021-04-29 20:15:12,"b""@deepigoyal it's good to know the steps u r taking to win customer's trust. But is your delivery team, Food prepara\xe2\x80\xa6 https://t.co/SfqOA3CnBB""",b'ashugreat1612',b'Delhi'
2021-04-29 19:47:03,b'Food delivery for Covid positive in Ujjain. https://t.co/hW3hleL8aD',b'bSoham_',b'Mantralay'
2021-04-29 19:46:55,"b'Here goes another food home delivery option for COVID families living near Baranagar , Cossipore , Sinthi More , Du\xe2\x80\xa6 https://t.co/Cyea3PvyN6'",b'QEBNA',"b'Kolkata, India'"
2021-04-29 19:43:22,"b'Here goes another food home delivery option for COVID families living along VIP Road , Nagerbajar , New Town , Raja\xe2\x80\xa6 https://t.co/uwrLNMJJ9b'",b'QEBNA',"b'Kolkata, India'"
2021-04-29 19:24:56,b'I don\xe2\x80\x99t understand why take away food and curbside delivery have been stopped....unless restaurant workers were getting the Covid from work.',b'shivkgs',"b'Port of Spain, Trinidad'"
2021-04-29 19:21:06,"b'Trying to help the covid positive patients with food, medicine and any kind of essential requirements delivery at t\xe2\x80\xa6 https://t.co/aJEGqqagrK'",b'iam_laphsup25',"b'Bengaluru, India'"
2021-04-29 19:19:07,b'More food delivery options during Covid-19 in Kolkata.\n\nPlease read the descriptions before ordering.\n\nI shall add\xe2\x80\xa6 https://t.co/0cpq0HTR9E',b'ovshake42',b'India'
2021-04-29 19:00:00,"b""Now you don't even need to leave the house to get your Girl Scout cookies.   https://t.co/ZZ2MSidcjh https://t.co/LyCE81CZqi""",b'USATODAYmoney',b'USA TODAY'
2021-04-29 18:58:20,b'Free food home delivery for covid affected people in Patna. Contact \n6206968062 ( Dr. Aprajita)',b'AayushS46288526',"b'Pune, India'"
2021-04-29 18:53:03,"b'Covid 19 Outbreak : Global Food Kit Delivery Market Revenue by Growth (2019-2027) and Analysis , Forecast (2020-202\xe2\x80\xa6 https://t.co/1mwySArgCm'",b'CrosslinkerAi',"b'Sunnyvale, CA'"
2021-04-29 18:47:44,b'Why did Resorts and Hotels stop serving Room Service/In Room Dining during the Covid-19 restrictions?\n\nhttps://t.co/qIETKjH4Lw',b'PushaThc',b'flat earth'
2021-04-29 18:16:23,b'@bubbly_ank @TVSPRAKASH @zomato @SwiggyCares please do your part in helping poor you can collect the delivery charg\xe2\x80\xa6 https://t.co/kgjTmEgxqw',b'Chaitanyaackr',b'Hyderabad'
2021-04-29 18:00:10,b'Don\xe2\x80\x99t Went To Cook Order Takeaway https://t.co/o6ErifWJjj #takeaway #delivery #food #foodporn #foodie #instafood\xe2\x80\xa6 https://t.co/IQDF1dXAJb',b'DudleySpice',"b'Dudley, England'"
2021-04-29 17:55:36,b'We are providing home cooked food. as per requirement during this pandemic.Everything freshly prepared keeping in m\xe2\x80\xa6 https://t.co/ehvgQjasJ8',b'rajatmal',b'Delhi'
2021-04-29 17:51:33,b'James Founder Deborah Williamson and ChowNow CEO @ChrisChowNow on the impact of COVID-19 on restaurants and food de\xe2\x80\xa6 https://t.co/bd3dCzgIRR',b'YahooFinance',"b'New York, NY'"
2021-04-29 17:47:45,"b'With the second wave of #COVID19 hitting India adversely, @Seasiainfotech created a #CovidTaskForce to support its\xe2\x80\xa6 https://t.co/ltoRUOIh5o'",b'Seasiainfotech',"b'USA, Australia, India, Canada'"
2021-04-29 17:10:29,"b'Recently, PPHI received a #NoKidHungry Early Childhood Grant to support the prescription program and help build a n\xe2\x80\xa6 https://t.co/5KRJDKhyqO'",b'nokidhungry',"b'Washington, DC'"
2021-04-29 17:04:17,"b'Global Online Food Delivery Services Market Report 2021: COVID-19 Growth, Impacts and\xc2\xa0\xe2\x80\xa6 https://t.co/GVWQJV0sCS'",b'tablelead',"b'Virginia, USA'"
2021-04-29 16:55:16,b'@DizisSANDY Food delivery for COVID patient kosam tweeted',b'a_Suman_',b'Hyderabad'
2021-04-29 16:44:55,"b'Delhi Gurudwara starts \xe2\x80\x9coxygen langar\xe2\x80\x9d, food delivery for COVID-19\xc2\xa0patients https://t.co/atQUVxA4Qm'",b'Matters_India',"b'Delhi, India'"
2021-04-29 16:37:35,b'Lastly if anyone from kolkata is unable to cook for themselves and their family this is a home delivery service off\xe2\x80\xa6 https://t.co/68ipznA1Vm',b'scarletwoman19',b''
2021-04-29 16:35:01,b'\xf0\x9f\x87\xba\xf0\x9f\x87\xb8 Food delivery apps face multibillion dollar hit as COVID pandemic lifts https://t.co/pgCZpFM5SS',b'NeilRetail',"b'Scottsdale, AZ'"
2021-04-29 16:14:42,"b'@astitvam Sir, how to make donations to your Covid relief (food delivery) efforts? Kindly share links...'",b'ajaykuligod',b''
2021-04-29 15:49:12,b'@amodranjan1 bhai  any leads for home delivery for food in patna for  covid patients.',b'maruti_13',"b'Bengaluru, India'"
2021-04-29 15:29:03,"b'Global Online Food Delivery Services Market Report 2021: COVID-19 Growth, Impacts and Change to 2030 -\xe2\x80\xa6 https://t.co/P6pvBKGtoo'",b'CrosslinkerAi',"b'Sunnyvale, CA'"
2021-04-29 15:18:48,b'Not everything was shitty about covid. \n\nAt least we now have the \xe2\x80\x9cleave it at the door\xe2\x80\x9d option for food delivery.',b'NatsukoSachi',b''
2021-04-29 15:14:09,b'Observed those battling Covid at Home sometimes entire families.\n1. Timely repeat Testing on onset of symptoms\n2. A\xe2\x80\xa6 https://t.co/MsqUf6CQdw',b'ImIndia5',b'Bharat'
2021-04-29 15:14:04,"b'@CenterParcsUK having a brilliant break, lovely and quiet, the delivery service for food is brilliant, deffo needs\xe2\x80\xa6 https://t.co/iBT5DNG1Df'",b'nicwarner12',b''
2021-04-29 15:06:35,"b'Global Online Food Delivery Services Market Report 2021: COVID-19 Growth, Impacts and Change to 2030 -\xe2\x80\xa6 https://t.co/EdhfL2UgSa'",b'CrosslinkerAi',"b'Sunnyvale, CA'"
2021-04-29 15:03:56,b'Asking for some help with contacts of home-cooked food delivery for a Covid-positive family based out of Madipakkam\xe2\x80\xa6 https://t.co/icczSGZQBE',b'bluenumber8',b''
2021-04-29 15:00:01,"b'In Christiansburg, Virginia, Girl Scout cookies are falling from the heavens.\n https://t.co/5r28RqGQOE'",b'USATODAYmoney',b'USA TODAY'
2021-04-29 14:59:37,"b'Global Online Food Delivery Services Market Report 2021: COVID-19 Growth, Impacts and Change to 2030 -\xe2\x80\xa6 https://t.co/mUNIysZ4iq'",b'CrosslinkerAi',"b'Sunnyvale, CA'"
2021-04-29 14:51:39,"b'Global Online Food Delivery Services Market Report 2021: COVID-19 Growth, Impacts and Change to 2030 -\xe2\x80\xa6 https://t.co/IXwy0CHJ8p'",b'CrosslinkerAi',"b'Sunnyvale, CA'"
2021-04-29 14:49:24,b'2/2...equipment to assist with Feed Nova Scotia\xe2\x80\x99s COVID-19 Food Box program which provides home delivery of groceri\xe2\x80\xa6 https://t.co/lg5dtdlYfb',b'midlandtrucking',"b'Dieppe, New Brunswick'"
2021-04-29 14:44:06,"b'Global Online Food Delivery Services Market Report 2021: COVID-19 Growth, Impacts and Change to 2030 -\xe2\x80\xa6 https://t.co/QzSDmXsl3H'",b'CrosslinkerAi',"b'Sunnyvale, CA'"
2021-04-29 14:43:11,b'Need food delivery help for COVID patients on Rourkela. I believe gurudwara is delivering too. Can anyone help with\xe2\x80\xa6 https://t.co/Z4cTZwDQfB',b'ankitapops',"b'New Delhi, India'"
2021-04-29 14:25:28,"b'@zomatoin order for my parents for contactless Delivery who r senior citizen and my brother is Covid positive, inst\xe2\x80\xa6 https://t.co/DlisBY8cFN'",b'AtulNagpal7',b'Gurugram'
2021-04-29 14:20:11,b'@Danimalsdoodoo At my job two days a week we unload a semi truck of food r/t Covid.  No delivery personal signs all\xe2\x80\xa6 https://t.co/uZpkgZSwdC',b'123curler',b''
2021-04-29 13:52:29,b'#GoogleWing #GirlScouts collaboration to innovate on cookie delivery in #Virginia\nhttps://t.co/ebaAzdlS3t',b'michvictor',"b'Washington, DC'"
2021-04-29 13:39:33,"b'@SOSJammuKashmir\nFood delivery for hospitalized patients in Srinagar: 6005705337, 7006775049 or 9419088919.\n\nHome d\xe2\x80\xa6 https://t.co/qlvypEDGPI'",b'RafeeqAhmadMir2',b'Jammu And Kashmir'
2021-04-29 13:15:07,b'@CNN Wait till all the food delivery and 3rd party like Uber / Lift type small struggling people find out Biden hid\xe2\x80\xa6 https://t.co/7EOQgnjei0',b'Gregory78534010',"b'Bensalem, PA'"
2021-04-29 13:14:57,"b'@SOSJammuKashmir\nFood delivery for hospitalized patients in Srinagar: 6005705337, 7006775049 or 9419088919.\n\nHome d\xe2\x80\xa6 https://t.co/CU40oYB8l6'",b'SOSJammuKashmir',b''
2021-04-29 13:14:36,b'COVID-19 has hampered the socio-economic stability in Malaysia and this burden was severely felt by the riders work\xe2\x80\xa6 https://t.co/PZKhxU7sNT',b'FocusMalaysiaMY',b'Malaysia'
2021-04-29 13:11:07,b'Food delivery apps face multibillion dollar hit as COVID pandemic lifts: study https://t.co/I7581M4rXa',b'DSMWcom',"b'Tampa, Florida'"
2021-04-29 13:09:24,"b'#SOSJK \n#SOSKashmir \n\nFood delivery for hospitalized patients in Srinagar: 6005705337, 7006775049 or 9419088919.\n\nH\xe2\x80\xa6 https://t.co/OYfMwZfvv7'",b'AmbreenShahh',b''
2021-04-29 13:04:27,b'@zomatocare \n@zomatoin \n@SwiggyCares \n@swiggy_in \n@anilvijminister \n@MoHFW_INDIA \n@drharshvardhan @AmitShah\xe2\x80\xa6 https://t.co/Mq3PT6E2GL',b'tharejaglass',b''
2021-04-29 13:01:17,b'Restaurant/food delivery workers: @roar_ny #NYCVaccineforAll Bus providing COVID vaccines at:\n\n- Astoria 4/25-4/27\xe2\x80\xa6 https://t.co/jIK21WphiJ',b'nycnightlifegov',"b'New York, NY'"
2021-04-29 12:59:33,"b'Delhi gurdwara starts \xe2\x80\x98Oxygen Langar\xe2\x80\x99, food delivery for COVID-19 patients - The Tribune India https://t.co/MsJecBJktz CROSSLINKER'",b'CrosslinkerAi',"b'Sunnyvale, CA'"
2021-04-29 12:56:59,b'Pocket Friendly Menu for Specially COVID Patients.\n\nFree home delivery\xe2\x80\xa6!!!\nCall us for order +91 75738 22299 \nFor O\xe2\x80\xa6 https://t.co/byJZgmvtvH',b'FoodFrozzy',"b'Ahmedabad, Gujarat, India'"
2021-04-29 12:48:48,"b'@grubbypea Very impressive for an artist, at least no need to do food delivery during covid.'",b'illegalHDBcat',b'Moon'
2021-04-29 12:48:15,"b""@AugustMoonRae Pre covid we would go for a date night once a week &amp; I'd meet a friend for dinnet / happy hour often\xe2\x80\xa6 https://t.co/MGOJ90M8pr""",b'HelloSerah',b''
2021-04-29 12:41:23,b'Any recommendations for food delivery in #Kolkata around CIT Road/Sealdah area? Family is COVID +ve and need to arrange food. \n\nThank you.',b'ferociousoxide',"b'London, England'"
2021-04-29 12:37:02,"b'Delhi gurdwara starts \xe2\x80\x98Oxygen Langar\xe2\x80\x99, food delivery for COVID-19\xc2\xa0patients https://t.co/9z9aPVckZi'",b'TheNewsCaravan',b'India'
2021-04-29 12:35:14,"b'Delhi gurdwara starts \xe2\x80\x98#OxygenLangar\xe2\x80\x99, food delivery for #COVID19 patients https://t.co/UjrMaKvpSc'",b'thetribunechd',b'Chandigarh'
2021-04-29 12:27:53,b'Food delivery apps face multibillion dollar hit as COVID lifts: study https://t.co/0TlBkLPYds',b'filterednews',b'United States'
2021-04-29 12:14:06,"b'Delhi gurdwara starts \xe2\x80\x98Oxygen Langar\xe2\x80\x99, food delivery for COVID-19 patients - The Tribune India https://t.co/bCdO1LBKO4 CROSSLINKER'",b'CrosslinkerAi',"b'Sunnyvale, CA'"
2021-04-29 11:59:45,"b'In 1984, crowds were searching for Gurudwaras and Sardars to burn them. \n\nToday they are searching for Gurudwaras f\xe2\x80\xa6 https://t.co/vEwKO3YM9q'",b'FlyingMariner',b'BLR'
2021-04-29 11:59:21,"b'Delhi Gurudwara starts \xe2\x80\x98Oxygen Langar\xe2\x80\x99, food delivery for COVID-19 patients | The Fact News\n#DelhiGurudwara\xe2\x80\xa6 https://t.co/v3G9Cz9pAy'",b'thefactnewsnet',b''
2021-04-29 11:57:33,"b'Zomato IPO: Sustained losses, competition, COVID among key risks for food delivery platform - CNBCTV18 https://t.co/OEnuHKLnfP CROSSLINKER'",b'CrosslinkerAi',"b'Sunnyvale, CA'"
2021-04-29 11:54:46,b'Food delivery apps face multibillion dollar hit as COVID pandemic lifts: study #NYP https://t.co/9QKySQ8cfM via @nypost',b'LisaFickenscher',b'New York City'
2021-04-29 11:49:28,b'Pls allow volunteers (following all Covid protocols) to deliver essential services like free food delivery to Covid\xe2\x80\xa6 https://t.co/OohIVBVrCa',b'KhajuriaManu',"b'London/Patna/Jammu, JK,India'"
2021-04-29 11:48:24,b'Rotaract Club of Muzaffarpur\n\nHome Delivery of free Food Packets for covid patients family\n\nApki sewa mai fir se ty\xe2\x80\xa6 https://t.co/Ql34lLXDst',b'anshulaman968',b'Muzaffarpur '
2021-04-29 11:42:07,b'Indian food-delivery startup Zomato files for a $1.1 billion IPO as the country battles a catastrophic wave of COVI\xe2\x80\xa6 https://t.co/rB5N2fX7YL',b'TechNewsTube',"b'Philadelphia, PA'"
2021-04-29 11:36:04,"b'@Khushbookhan_ I\xe2\x80\x99m covid positive and I have been ordering on swiggy from past 10 days.\nSo far, delivery has been s\xe2\x80\xa6 https://t.co/TV77m8oCJc'",b'mdminhaz484',b'New Delhi'
2021-04-29 11:26:56,"b""Delhi Gurudwara starts 'Oxygen Langar', food delivery for COVID-19 patients https://t.co/6lj84YaCgW via\xe2\x80\xa6 https://t.co/HapMhSPes4""",b'tirshinazar',"b'Chandigarh, India'"
2021-04-29 11:24:11,b'@TheEskdale @VisitBritain 2/2 Link to the map \xf0\x9f\x91\x87 Full of wonderful suppliers across the National Park \xf0\x9f\x98\x8a Some places\xe2\x80\xa6 https://t.co/cJvbZWEyXW',b'northyorkmoors',b'North York Moors National Park'
2021-04-29 10:44:30,"b'Food delivery for hospitalized patients in Srinagar: 6005705337, 7006775049 or 9419088919.\n\nHome delivery of food f\xe2\x80\xa6 https://t.co/VroDqaR4h1'",b'kashmiriumar999',b'Jammu And Kashmir \xf0\x9f\x87\xa8\xf0\x9f\x87\xae'
2021-04-29 10:44:03,b'Indian food-delivery startup Zomato files for a $1.1 billion IPO as the country battles a catastrophic wave of COVI\xe2\x80\xa6 https://t.co/FUhXGvWZCX',b'limitlesspower7',"b'England, United Kingdom'"
2021-04-29 10:38:24,"b'\xf0\x9f\x9a\xa8\xf0\x9f\x9a\xa8\xf0\x9f\x9a\xa8\xf0\x9f\x9a\xa8\xf0\x9f\x9a\xa8\xf0\x9f\x9a\xa8\xf0\x9f\x9a\xa8\xf0\x9f\x9a\xa8\nFREE \nCovid Food Service\nHomemade food for covid patients\n\nlocation\nHOTEL HIMLAND EAST, Circular road,\xe2\x80\xa6 https://t.co/Iwlo9lWsdL'",b'BackupBae',b''
2021-04-29 10:36:53,b'Covid-19 mission in progress with food delivery for the covid affected families and institution.Let us all be unite\xe2\x80\xa6 https://t.co/6vh0kMnhKB',b'SocialVisionOrg',"b'New Delhi, India'"
2021-04-29 10:36:43,"b'Food delivery for hospitalized patients in Srinagar: 6005705337, 7006775049 or 9419088919.\n\nHome delivery of food f\xe2\x80\xa6 https://t.co/ptT9ZFpOlM'",b'Altxk',b'Jammu & Kashmir'
2021-04-29 10:32:13,b'@KapilChopra72 @amitoj @OmarAbdullah *Gurudwara Singh Sabha located in Greater Kailash area of the national capital\xe2\x80\xa6 https://t.co/a9Qlprw6ut',b'Neeru_Bahl',"b'New Delhi, India'"
2021-04-29 10:25:13,"b'Kolkata, please amplify this. Food Delivery for Covid patients.\n\nAbar khabo:\n9007718187 / 8335887274\n\n#Verified'",b'Mirmawiya0',b'Kashmir'
2021-04-29 10:24:01,"b'Delhi Gurudwara Starts \xe2\x80\x9cOxygen Langar\xe2\x80\x9d, Food Delivery For Covid\xc2\xa0Patients https://t.co/AUzcQquoy6'",b'TimesofNewsHUB',b''
2021-04-29 10:21:01,"b'@NandiGuptaBJP &amp; @AbhilashaBJP Pariwar offering free food in Prayagraj for Covid patients, free delivery also.\n\nYou\xe2\x80\xa6 https://t.co/Hux1ObAzng'",b'GauravVirendraA',"b'Delhi, Prayagraj & Mumbai'"
2021-04-29 10:08:33,"b'Delhi Gurudwara Starts ""Oxygen Langar"", Food Delivery For COVID-19 Patients - NDTV https://t.co/cDOprGW7LK CROSSLINKER'",b'CrosslinkerAi',"b'Sunnyvale, CA'"
2021-04-29 10:04:09,"b'DOH Town Hall on COVID-19 Vaccine Deployment Plan with Restaurants, Food Preparation and Delivery https://t.co/tHDyZYqlNc via @FacebookWatch'",b'KapataganMPS',b''
2021-04-29 10:02:02,"b'Delhi Gurudwara Starts ""Oxygen Langar"", Food Delivery For Covid Patients https://t.co/ISh6GfY4t9 https://t.co/06onajYH1e'",b'ndtvfeed',b''
2021-04-29 10:00:17,"b""Indian food delivery startup @zomato, backed by China's @antgroup, has filed for an initial public offering of up t\xe2\x80\xa6 https://t.co/DONvP5Lh4V""",b'KrASIAofficial',b'Singapore'
2021-04-29 09:19:04,"b'""Apps News: Food delivery apps face multibillion dollar hit as COVID pandemic lifts: study - New York Post #News"": https://t.co/aUYPQSzpY1'",b'robinsnewswire',"b""RT's Are FYI Purposes Only"""
2021-04-29 09:14:32,"b""Delhi Gurudwara starts 'Oxygen Langar', food delivery for COVID-19 patients - ANI News https://t.co/ypBfYBrWjg CROSSLINKER""",b'CrosslinkerAi',"b'Sunnyvale, CA'"
2021-04-29 09:09:45,"b""Delhi Gurudwara starts 'Oxygen Langar', food delivery for COVID-19 patients\n\nRead @ANI Story |\xe2\x80\xa6 https://t.co/k6PDEO8wMv""",b'ani_digital',b'India'
2021-04-29 09:06:13,"b'Delhi Gurudwara starts \xe2\x80\x98Oxygen Langar\xe2\x80\x99, food delivery for COVID-19\xc2\xa0patients https://t.co/uFTT178NgP'",b'INDdotNews',b''
2021-04-29 09:02:58,b'Indian food-delivery start-up Zomato declare a $1.1 billion IPO as the nation fights a tragic wave of COVID-19\xc2\xa0infe\xe2\x80\xa6 https://t.co/kqm5k6hl0D',b'guncelkalnet',b'Amerika Birle\xc5\x9fik Devletleri'
2021-04-29 08:51:17,"b'India: Zomato files papers for Rs 8,250 cr IPO as orders surge during COVID pandemic https://t.co/9qQOsOrip1\xe2\x80\xa6 https://t.co/kjAW8H7KQB'",b'VOAStevenson',b'Washington DC'
2021-04-29 08:47:26,b'@deepigoyal @zomato I am confident and hence assuming @zomato would have already thought of leveraging its delivery\xe2\x80\xa6 https://t.co/tmsd81xMVX',b'atiwariplusone',b'India'
2021-04-29 08:34:51,"b'Any reliable good food delivery for home cooked  food service for a family of 5..the kids are negative, their grand\xe2\x80\xa6 https://t.co/pmqAGLCsYd'",b'NargisMirza6',b''
2021-04-29 08:24:49,b'Here goes another option for home delivery of cooked food for COVID affected families living in Baruipur.\nDirectly\xe2\x80\xa6 https://t.co/y6OlTGjh1Z',b'QEBNA',"b'Kolkata, India'"
2021-04-29 08:20:34,b'Understanding Impact of COVID-19 on Delivery And Takeaway Food Market \xe2\x80\x93 The Courier - The Courier https://t.co/qQfFa048IK CROSSLINKER',b'CrosslinkerAi',"b'Sunnyvale, CA'"
2021-04-29 08:17:33,b'Indian food-delivery startup Zomato files for a $1.1 billion IPO as the country battles a catastrophic wave of COVI\xe2\x80\xa6 https://t.co/qeK21tUqKy',b'MarketingGeek_',b''
2021-04-29 08:17:05,b'Indian food-delivery startup Zomato files for a $1.1 billion IPO as the country battles a catastrophic wave of COVI\xe2\x80\xa6 https://t.co/K8LF7pzqs4',b'ManLeeHood',"b'Simi Valley, CA'"
2021-04-29 08:12:34,b'Indian food-delivery startup Zomato files for a $1.1 billion IPO as the country battles a catastrophic wave of COVI\xe2\x80\xa6 https://t.co/fkQuNiyGPR',b'marciojmsilva',"b'Porto, Portugal'"
2021-04-29 08:10:06,b'Indian food-delivery startup Zomato files for a $1.1 billion IPO as the country battles a catastrophic wave of COVI\xe2\x80\xa6 https://t.co/hQT6nG308i',b'MktsInsider',"b'New York, NY'"
2021-04-29 08:04:14,b'Global Food Delivery Apps Market Covid-19 Impact Analysis To 2025 \xe2\x80\x93 Industry Perspective ...\nhttps://t.co/h3z0sQoGoP',b'RideshareAZ',"b'Phoenix, AZ'"
2021-04-29 07:50:05,b'Food delivery apps face multibillion dollar hit as COVID pandemic lifts: study https://t.co/TC5nKKewmN https://t.co/1pWShRkKOo',b'shakir_essa',b'United States'
2021-04-29 07:41:02,b'\xe2\x80\x98Unknown friend\xe2\x80\x99 in extreme danger of Kovid infected family! Free food delivery to covid 19 patients and family in\xe2\x80\xa6 https://t.co/RtjNgJ9xux',b'thetimesfbengal',"b'Garia, Kolkata'"
2021-04-29 07:32:15,"b'Here goes another option for home delivery of cooked food for COVID affected families living in Saltlake, Rajarhat,\xe2\x80\xa6 https://t.co/WW4IW8TbfL'",b'QEBNA',"b'Kolkata, India'"
2021-04-29 07:19:03,"b'""Apps News: Food delivery apps face multibillion dollar hit as COVID pandemic lifts: study - New York Post #News"": https://t.co/aUYPQShOzr'",b'robinsnewswire',"b""RT's Are FYI Purposes Only"""
2021-04-29 07:14:08,"b'Zomato files papers for Rs 8,250 cr IPO as Covid lifts food delivery biz.\n\nPage Link: https://t.co/7MoW56kuLT\xe2\x80\xa6 https://t.co/MsLZtIyk8h'",b'PaperboyOnline',b'India'
2021-04-29 07:13:44,"b'SOS - FOOD Needed for COVID Patient.\n\nLocation: Ganga Medical Centre, Tughlaqabad, Delhi\n\nEveryday Delivery till di\xe2\x80\xa6 https://t.co/XwgAe0jX3V'",b'Bihar_ke_lala',"b'Patna, Delhi, FATA'"
2021-04-29 07:04:31,b'Food delivery apps face multibillion dollar hit as COVID pandemic lifts:\xc2\xa0study https://t.co/dLwzD3BTJV',b'AjayStfc',b'india'
2021-04-29 06:31:09,b'food delivery for Covid positive patients in #Indore.\n\n\xe2\x97\x86Contact\xe2\x97\x86\n\n\xe2\x97\x8f9893185675\n\xe2\x97\x8f7489622717 #INDORE \n#IndoreFightsCorona',b'SayedShadabFar1',"b'Kolkata, India'"
2021-04-29 06:12:27,"b'Free Food home delivery for #Covid patients under home isolation in #Delhi Ashok Vihar, Adarsh Nagar, Shalimar Bagh\xe2\x80\xa6 https://t.co/Pg6bHgEX8W'",b'Bikash_Agarwal_',"b'Odisha , India'"
2021-04-29 06:09:04,b'@blrcitytraffic Sir i need to travel from my home 7th phase JP  Nagar to 2nd phase JP Nagar my kitchen to organize\xe2\x80\xa6 https://t.co/EbuGl9cnRI',b'babasahay',b''
2021-04-29 06:04:59,b'food delivery for Covid positive patients in #Indore.\n\n\xe2\x97\x86Contact\xe2\x97\x86\n\n\xe2\x97\x8f9893185675\n\xe2\x97\x8f7489622717 #Indore',b'rudrastic',b'Finding plasma'
2021-04-29 06:03:01,"b""Free Food available for COVID peoples (Home delivery too)\nDOCUMENTS REQUIRED\n*COVID POSITIVE REPORT\n*PATIENT'S AADH\xe2\x80\xa6 https://t.co/t8U7xvgFOR""",b'rudrastic',b'Finding plasma'
2021-04-29 05:52:05,"b'Zomato Files for Rs. 8,250-Crore IPO as Food Delivery Surges in Pandemic https://t.co/7O8Z6pekP2 https://t.co/7G4J4UxUtC'",b'EmileeCHatch',"b'California, USA'"
2021-04-29 05:49:37,"b'*URGENT SOS - FOOD Needed for COVID Patient*\nName: K Mazumdar, Covid patient, Contact: Anupam Mazumdar \nLocation: G\xe2\x80\xa6 https://t.co/pWuTmzHGPx'",b'IamRohitpathak',b'New Delhi'
2021-04-29 05:32:50,b'Food delivery apps face multibillion dollar hit as COVID pandemic lifts: study https://t.co/tgQ3Q8LkV8 #Business',b'15MinuteNewsBus',b''
2021-04-29 05:03:10,b'Food delivery apps face multibillion dollar hit as COVID pandemic lifts:\xc2\xa0study https://t.co/6I8fzVanaO',b'NgospelMedia',b'Nigeria'
2021-04-29 04:33:33,b'Food delivery apps face multibillion dollar hit as COVID lifts: study - Report Door https://t.co/4xjVt6p6mf CROSSLINKER',b'CrosslinkerAi',"b'Sunnyvale, CA'"
2021-04-29 04:33:08,"b'@CMOMaharashtra @OfficeofUT @rajeshtope11 Allow hotels to provide home delivery meal from 7am to 11pm, providing fo\xe2\x80\xa6 https://t.co/hM6tmPGCYE'",b'sailesh2000',b'Mumbai'
2021-04-29 04:32:09,b'#OxygenCylinders available in #Indore Free Of Cost\nAll you need to do is just get it refilled before returning us b\xe2\x80\xa6 https://t.co/CVnymJN6jY',b'Pradyuman04',b''
2021-04-29 04:26:04,b'Food delivery apps face multibillion dollar hit as COVID lifts: study \xe2\x80\x93 The Madison Leader Gazette - The Madison Le\xe2\x80\xa6 https://t.co/xCZGTa2KJE',b'CrosslinkerAi',"b'Sunnyvale, CA'"
